bLength: 0x12
bDescriptorType: 0x1
bcdUSB:  0x110
bDeviceClass:  0x9
bDeviceSubClass:  0x0
 bDeviceProtocol:  0x0
bMaxPacketSize0:  0x8
idVendor:  0x0
idProduct:  0x0
bcdDevice:  0x205
iManufacturer:  0x3
 iProduct:  0x2
iSerialNumber:  0x1
bNumConfigurations:  0x1
Testing: 0x0, 0x0
Successful

Looking for:
bLength: 0x12
bDescriptorType: 0x1
bcdUSB:  0x110
bDeviceClass:  0x9
bDeviceSubClass:  0x0
 bDeviceProtocol:  0x0
bMaxPacketSize0:  0x8
idVendor:  0xc12
idProduct:  0x8801
bcdDevice:  0x1
iManufacturer:  0x0
 iProduct:  0x1
iSerialNumber:  0x0
bNumConfigurations:  0x1
Testing: 0x0, 0x0
Successful

Looking for:
bLength: 0x12
bDescriptorType: 0x1
bcdUSB:  0x110
bDeviceClass:  0x9
bDeviceSubClass:  0x0
 bDeviceProtocol:  0x0
bMaxPacketSize0:  0x8
idVendor:  0xc12
idProduct:  0x8801
bcdDevice:  0x1
iManufacturer:  0x0
 iProduct:  0x1
iSerialNumber:  0x0
bNumConfigurations:  0x1
Testing: 0x44f, 0xf07
Testing: 0x45e, 0x202
Testing: 0x45e, 0x285
Testing: 0x45e, 0x289
Testing: 0x46d, 0xca88
Testing: 0x64d, 0xca84
Testing: 0x5fd, 0x1007
Testing: 0x5fd, 0x107a
Testing: 0x738, 0x4516
Testing: 0x738, 0x4522
Testing: 0x738, 0x4526
Testing: 0x738, 0x4536
Testing: 0x738, 0x4540
Testing: 0x738, 0x4556
Testing: 0x738, 0x6040
Testing: 0xc12, 0x8801
Successful

Looking for:
bLength: 0x12
bDescriptorType: 0x1
bcdUSB:  0x110
bDeviceClass:  0x9
bDeviceSubClass:  0x0
 bDeviceProtocol:  0x0
bMaxPacketSize0:  0x8
idVendor:  0xc12
idProduct:  0x8801
bcdDevice:  0x1
iManufacturer:  0x0
 iProduct:  0x1
iSerialNumber:  0x0
bNumConfigurations:  0x1
Testing: 0x40b, 0x6521
Testing: 0x45e, 0x284
Failed. Returning NULL

Looking for:
bLength: 0x12
bDescriptorType: 0x1
bcdUSB:  0x110
bDeviceClass:  0x9
bDeviceSubClass:  0x0
 bDeviceProtocol:  0x0
bMaxPacketSize0:  0x8
idVendor:  0xc12
idProduct:  0x8801
bcdDevice:  0x1
iManufacturer:  0x0
 iProduct:  0x1
iSerialNumber:  0x0
bNumConfigurations:  0x1
Testing: 0x0, 0x0
Failed. Returning NULL
